{
  "name": "Spring Integration",
  "description": "Enterprise integration patterns support for Spring",
  "repo": "spring-projects/spring-integration",
  "homepage": "https://spring.io/projects/spring-integration",
  "license": "Apache-2.0",
  "tags": [
    "java",
    "spring",
    "integration",
    "messaging",
    "eip"
  ],
  "packages": [
    {
      "name": "spring-integration",
      "aliases": [
        {
          "ecosystem": "maven",
          "name": "spring-integration"
        }
      ],
      "sources": [
        {
          "type": "github",
          "repo": "spring-projects/spring-integration"
        }
      ]
    }
  ]
}
