{
  "name": "PR-Agent",
  "description": "AI-powered tool for automated pull request analysis and feedback",
  "repo": "qodo-ai/pr-agent",
  "license": "Apache-2.0",
  "tags": [
    "ai",
    "code-review",
    "pull-request",
    "devtools"
  ],
  "packages": [
    {
      "name": "pr-agent",
      "aliases": [
        {
          "ecosystem": "pypi",
          "name": "pr-agent"
        }
      ],
      "sources": [
        {
          "type": "github",
          "repo": "qodo-ai/pr-agent",
          "path": "docs"
        }
      ]
    }
  ]
}
