{
  "name": "Spring Framework",
  "description": "Core support framework for Java applications",
  "repo": "spring-projects/spring-framework",
  "homepage": "https://spring.io/projects/spring-framework",
  "license": "Apache-2.0",
  "tags": [
    "java",
    "spring",
    "framework",
    "di",
    "aop"
  ],
  "packages": [
    {
      "name": "spring-framework",
      "aliases": [
        {
          "ecosystem": "maven",
          "name": "spring-framework"
        }
      ],
      "sources": [
        {
          "type": "github",
          "repo": "spring-projects/spring-framework"
        }
      ]
    }
  ]
}
