{
  "name": "Tailwind CSS",
  "description": "Utility-first CSS framework",
  "repo": "tailwindlabs/tailwindcss",
  "homepage": "https://tailwindcss.com",
  "license": "MIT",
  "tags": [
    "css",
    "framework",
    "utility"
  ],
  "packages": [
    {
      "name": "tailwindcss",
      "aliases": [
        {
          "ecosystem": "npm",
          "name": "tailwindcss"
        }
      ],
      "sources": [
        {
          "type": "github",
          "repo": "tailwindlabs/tailwindcss"
        },
        {
          "type": "web",
          "urls": [
            "https://tailwindcss.com/docs"
          ],
          "maxDepth": 2,
          "allowedPathPrefix": "/docs"
        }
      ]
    }
  ]
}
