{
  "name": "LiteLLM",
  "description": "Call 100+ LLM APIs using the OpenAI format",
  "repo": "BerriAI/litellm",
  "homepage": "https://docs.litellm.ai",
  "license": "MIT",
  "tags": [
    "ai",
    "llm",
    "openai",
    "proxy",
    "python"
  ],
  "packages": [
    {
      "name": "litellm",
      "aliases": [
        {
          "ecosystem": "pypi",
          "name": "litellm"
        }
      ],
      "sources": [
        {
          "type": "github",
          "repo": "BerriAI/litellm",
          "path": "docs"
        }
      ]
    }
  ]
}
