{
  "name": "Next.js",
  "description": "The React framework by Vercel",
  "repo": "vercel/next.js",
  "homepage": "https://nextjs.org",
  "license": "MIT",
  "tags": [
    "react",
    "framework",
    "ssr",
    "vercel"
  ],
  "packages": [
    {
      "name": "next",
      "aliases": [
        {
          "ecosystem": "npm",
          "name": "next"
        }
      ],
      "sources": [
        {
          "type": "npm",
          "package": "next",
          "path": "dist/docs"
        },
        {
          "type": "github",
          "repo": "vercel/next.js",
          "path": "docs"
        }
      ]
    }
  ]
}
