{
  "name": "Flask",
  "description": "Lightweight WSGI web application framework",
  "repo": "pallets/flask",
  "homepage": "https://flask.palletsprojects.com",
  "license": "BSD-3-Clause",
  "tags": [
    "python",
    "web",
    "framework",
    "wsgi"
  ],
  "packages": [
    {
      "name": "flask",
      "aliases": [
        {
          "ecosystem": "pypi",
          "name": "flask"
        }
      ],
      "sources": [
        {
          "type": "github",
          "repo": "pallets/flask",
          "path": "docs"
        }
      ]
    }
  ]
}
