{
  "name": "Spring AI",
  "description": "AI engineering framework for Spring applications",
  "repo": "spring-projects/spring-ai",
  "homepage": "https://spring.io/projects/spring-ai",
  "license": "Apache-2.0",
  "tags": [
    "java",
    "spring",
    "ai",
    "llm"
  ],
  "packages": [
    {
      "name": "spring-ai",
      "aliases": [
        {
          "ecosystem": "maven",
          "name": "spring-ai"
        }
      ],
      "sources": [
        {
          "type": "github",
          "repo": "spring-projects/spring-ai"
        }
      ]
    }
  ]
}
