{
  "name": "FastAPI",
  "description": "High-performance Python web framework",
  "repo": "fastapi/fastapi",
  "homepage": "https://fastapi.tiangolo.com",
  "license": "MIT",
  "tags": [
    "python",
    "api",
    "async",
    "web"
  ],
  "packages": [
    {
      "name": "fastapi",
      "aliases": [
        {
          "ecosystem": "pypi",
          "name": "fastapi"
        }
      ],
      "sources": [
        {
          "type": "github",
          "repo": "fastapi/fastapi",
          "path": "docs"
        },
        {
          "type": "web",
          "urls": [
            "https://fastapi.tiangolo.com"
          ],
          "maxDepth": 2,
          "allowedPathPrefix": "/tutorial"
        }
      ]
    }
  ]
}
