{
  "name": "LangGraph.js",
  "description": "Library for building stateful, multi-actor AI applications in JS/TS",
  "repo": "langchain-ai/langgraphjs",
  "homepage": "https://langchain-ai.github.io/langgraphjs/",
  "license": "MIT",
  "tags": [
    "ai",
    "agents",
    "langchain",
    "graph",
    "typescript"
  ],
  "packages": [
    {
      "name": "@langchain/langgraph",
      "aliases": [
        {
          "ecosystem": "npm",
          "name": "@langchain/langgraph"
        },
        {
          "ecosystem": "npm",
          "name": "@langchain/langgraph-sdk"
        }
      ],
      "sources": [
        {
          "type": "github",
          "repo": "langchain-ai/langgraphjs",
          "path": "docs"
        }
      ]
    }
  ]
}
