{
  "name": "Stanza",
  "description": "Stanford NLP Python library for many human languages",
  "repo": "stanfordnlp/stanza",
  "homepage": "https://stanfordnlp.github.io/stanza/",
  "license": "Apache-2.0",
  "tags": [
    "nlp",
    "stanford",
    "python",
    "linguistics"
  ],
  "packages": [
    {
      "name": "stanza",
      "aliases": [
        {
          "ecosystem": "pypi",
          "name": "stanza"
        }
      ],
      "sources": [
        {
          "type": "github",
          "repo": "stanfordnlp/stanza",
          "path": "doc"
        }
      ]
    }
  ]
}
