{
  "name": "Spring Security",
  "description": "Authentication and access-control framework for Spring",
  "repo": "spring-projects/spring-security",
  "homepage": "https://spring.io/projects/spring-security",
  "license": "Apache-2.0",
  "tags": [
    "java",
    "spring",
    "security",
    "authentication",
    "authorization"
  ],
  "packages": [
    {
      "name": "spring-security",
      "aliases": [
        {
          "ecosystem": "maven",
          "name": "spring-security"
        },
        {
          "ecosystem": "maven",
          "name": "org.springframework.security:spring-security-core"
        }
      ],
      "sources": [
        {
          "type": "github",
          "repo": "spring-projects/spring-security"
        }
      ]
    }
  ]
}
