{
  "name": "Nuxt UI",
  "description": "Comprehensive Vue UI component library with 125+ accessible Tailwind CSS components",
  "repo": "nuxt/ui",
  "homepage": "https://ui.nuxt.com",
  "license": "MIT",
  "tags": [
    "vue",
    "nuxt",
    "ui",
    "components",
    "tailwindcss"
  ],
  "packages": [
    {
      "name": "@nuxt/ui",
      "aliases": [
        {
          "ecosystem": "npm",
          "name": "@nuxt/ui"
        },
        {
          "ecosystem": "npm",
          "name": "nuxt-ui"
        }
      ],
      "sources": [
        {
          "type": "github",
          "repo": "nuxt/ui",
          "path": "docs"
        },
        {
          "type": "llms-txt",
          "url": "https://ui.nuxt.com/llms.txt"
        },
        {
          "type": "llms-txt",
          "url": "https://ui3.nuxt.com/llms.txt"
        }
      ]
    }
  ]
}
