{
  "name": "jQuery",
  "description": "Fast, small, and feature-rich JavaScript library",
  "repo": "jquery/jquery",
  "homepage": "https://jquery.com",
  "license": "MIT",
  "tags": [
    "dom",
    "manipulation",
    "ajax",
    "browser"
  ],
  "packages": [
    {
      "name": "jquery",
      "aliases": [
        {
          "ecosystem": "npm",
          "name": "jquery"
        }
      ],
      "sources": [
        {
          "type": "github",
          "repo": "jquery/jquery"
        }
      ]
    }
  ]
}
