{
  "name": "Lodash",
  "description": "Modern JavaScript utility library delivering modularity and performance",
  "repo": "lodash/lodash",
  "homepage": "https://lodash.com",
  "license": "MIT",
  "tags": [
    "utility",
    "functional",
    "collections",
    "arrays"
  ],
  "packages": [
    {
      "name": "lodash",
      "aliases": [
        {
          "ecosystem": "npm",
          "name": "lodash"
        }
      ],
      "sources": [
        {
          "type": "github",
          "repo": "lodash/lodash"
        }
      ]
    }
  ]
}
