{
  "name": "FastMCP",
  "description": "Fast, Pythonic way to build MCP servers and clients",
  "repo": "jlowin/fastmcp",
  "license": "MIT",
  "tags": [
    "mcp",
    "ai",
    "agents",
    "python",
    "server"
  ],
  "packages": [
    {
      "name": "fastmcp",
      "aliases": [
        {
          "ecosystem": "pypi",
          "name": "fastmcp"
        }
      ],
      "sources": [
        {
          "type": "github",
          "repo": "jlowin/fastmcp",
          "path": "docs"
        }
      ]
    }
  ]
}
