{
  "name": "pyinfra",
  "description": "Infrastructure automation in Python",
  "repo": "Fizzadar/pyinfra",
  "homepage": "https://pyinfra.com",
  "license": "MIT",
  "tags": [
    "infrastructure",
    "automation",
    "devops",
    "python"
  ],
  "packages": [
    {
      "name": "pyinfra",
      "aliases": [
        {
          "ecosystem": "pypi",
          "name": "pyinfra"
        }
      ],
      "sources": [
        {
          "type": "github",
          "repo": "Fizzadar/pyinfra",
          "path": "docs"
        }
      ]
    }
  ]
}
