{
  "name": "Kubernetes",
  "description": "Production-grade container orchestration",
  "repo": "kubernetes/kubernetes",
  "homepage": "https://kubernetes.io",
  "license": "Apache-2.0",
  "tags": [
    "containers",
    "orchestration",
    "cloud-native",
    "go"
  ],
  "packages": [
    {
      "name": "kubernetes",
      "aliases": [
        {
          "ecosystem": "go",
          "name": "kubernetes"
        }
      ],
      "sources": [
        {
          "type": "github",
          "repo": "kubernetes/kubernetes",
          "path": "docs"
        }
      ]
    }
  ]
}
