{
  "name": "Jest",
  "description": "Delightful JavaScript testing framework",
  "repo": "jestjs/jest",
  "homepage": "https://jestjs.io",
  "license": "MIT",
  "tags": [
    "testing",
    "javascript",
    "typescript",
    "meta"
  ],
  "packages": [
    {
      "name": "jest",
      "aliases": [
        {
          "ecosystem": "npm",
          "name": "jest"
        }
      ],
      "sources": [
        {
          "type": "github",
          "repo": "jestjs/jest",
          "path": "docs"
        }
      ]
    }
  ]
}
