{
  "name": "Nuxt",
  "description": "The Intuitive Vue Framework",
  "repo": "nuxt/nuxt",
  "homepage": "https://nuxt.com",
  "license": "MIT",
  "tags": [
    "vue",
    "framework",
    "ssr",
    "nitro"
  ],
  "packages": [
    {
      "name": "nuxt",
      "aliases": [
        {
          "ecosystem": "npm",
          "name": "nuxt"
        }
      ],
      "sources": [
        {
          "type": "github",
          "repo": "nuxt/nuxt",
          "path": "docs"
        },
        {
          "type": "llms-txt",
          "url": "https://nuxt.com/llms.txt"
        }
      ]
    }
  ]
}
