{
  "name": "Express",
  "description": "Fast, unopinionated, minimalist web framework for Node.js",
  "repo": "expressjs/express",
  "homepage": "https://expressjs.com",
  "license": "MIT",
  "tags": [
    "node",
    "web",
    "framework",
    "middleware"
  ],
  "packages": [
    {
      "name": "express",
      "aliases": [
        {
          "ecosystem": "npm",
          "name": "express"
        }
      ],
      "sources": [
        {
          "type": "github",
          "repo": "expressjs/express"
        }
      ]
    }
  ]
}
