{
  "name": "React",
  "description": "Library for building user interfaces",
  "repo": "facebook/react",
  "homepage": "https://react.dev",
  "license": "MIT",
  "tags": [
    "ui",
    "components",
    "virtual-dom",
    "meta"
  ],
  "packages": [
    {
      "name": "react",
      "aliases": [
        {
          "ecosystem": "npm",
          "name": "react"
        },
        {
          "ecosystem": "npm",
          "name": "react-dom"
        },
        {
          "ecosystem": "npm",
          "name": "react-reconciler"
        }
      ],
      "sources": [
        {
          "type": "github",
          "repo": "facebook/react"
        }
      ]
    }
  ]
}
